{
  "version": "authoring-v1",
  "brief_version": "authoring-brief-v2",
  "dataset": "development",
  "tasks": [
    {
      "id": "SYNTHETIC-K01",
      "family": "F1",
      "coverage_tags": {
        "chain_depth": 3,
        "distance": 3,
        "entity_similarity": "distinct",
        "ambiguity_status": "active",
        "provenance_need": "none",
        "context_pressure": "within",
        "verbatim_possible": true,
        "subcases": [
          "revisit"
        ]
      },
      "conversation": [
        {
          "id": "SYNTHETIC-K01-m001",
          "text": "[SYNTHETIC-K01-m001] Use nalvi-7 as the Velrin bench drawer code.",
          "recap": false
        },
        {
          "id": "SYNTHETIC-K01-m002",
          "text": "[SYNTHETIC-K01-m002] Replace that drawer code with zekru-4.",
          "recap": false
        },
        {
          "id": "SYNTHETIC-K01-m003",
          "text": "[SYNTHETIC-K01-m003] Change the Velrin bench drawer code back to nalvi-7.",
          "recap": false
        },
        {
          "id": "SYNTHETIC-K01-m004",
          "text": "[SYNTHETIC-K01-m004] Replace the Velrin bench drawer code with tovri-8.",
          "recap": false
        },
        {
          "id": "SYNTHETIC-K01-m005",
          "text": "[SYNTHETIC-K01-m005] The courtyard mural depicts a boat beside a winding path.",
          "recap": false
        },
        {
          "id": "SYNTHETIC-K01-m006",
          "text": "[SYNTHETIC-K01-m006] A visitor sketched the ceiling beams in a small notebook.",
          "recap": false
        },
        {
          "id": "SYNTHETIC-K01-m007",
          "text": "[SYNTHETIC-K01-m007] The garden fountain splashed beside the stone benches.",
          "recap": false
        }
      ],
      "field_map": {
        "code": {
          "dimension": "current",
          "record": "SYNTHETIC-K01-p001",
          "kind": "current",
          "checkpoint": null
        }
      },
      "probes": [
        {
          "id": "SYNTHETIC-K01-q001",
          "position": "SYNTHETIC-K01-m007",
          "wording": "[SYNTHETIC-K01-q001] What is the Velrin bench drawer code now?\n\nReturn one JSON object with exactly these fields, each once: code. No fences, commentary, extra fields, nested objects, or booleans. Numeric fields: JSON integers, never quoted, decimal, or unit-bearing. Text/IDs: JSON strings. Copy text exactly, including case, spelling, punctuation, and spacing; add no articles or descriptions. Use JSON null only under each field's null rule, never \"null\", \"\", or guesses; null is not unknown/refusal. Arrays only for declared set fields.\n\ncode: one value in force now, as an exact JSON string; JSON null if expired, unestablished, or unresolved (no unique value).",
          "field_map": {
            "code": {
              "dimension": "current",
              "record": "SYNTHETIC-K01-p001",
              "kind": "current",
              "checkpoint": null
            }
          },
          "expected": {
            "code": "tovri-8"
          },
          "set_fields": [],
          "unknown_answers": [],
          "alternative_answers": [],
          "requirements": [
            "SYNTHETIC-K01-r007"
          ],
          "outcomes": {
            "correct": "$continue",
            "incorrect": "$reject",
            "unknown": "$reject",
            "malformed": "$reject",
            "timeout": "$reject"
          }
        }
      ],
      "state_history": [
        {
          "id": "SYNTHETIC-K01-p001",
          "entity": "Velrin bench",
          "property": "drawer code",
          "scope": "workshop",
          "status_labels": {
            "active": "active",
            "expired": "expired",
            "unestablished": "unestablished",
            "unresolved": "unresolved"
          },
          "versions": [
            {
              "id": "SYNTHETIC-K01-v001",
              "message": "SYNTHETIC-K01-m001",
              "change": "establish",
              "status": "active",
              "value": "nalvi-7",
              "sources": [
                {
                  "message": "SYNTHETIC-K01-m001",
                  "authority": "workshop coordinator",
                  "value": "nalvi-7"
                }
              ],
              "time": {
                "begin": null,
                "end": null
              },
              "applicability": "Velrin bench, drawer code, workshop",
              "requirements": [
                {
                  "id": "SYNTHETIC-K01-r001",
                  "kind": "current",
                  "begin_after": "SYNTHETIC-K01-m001",
                  "end_before": "SYNTHETIC-K01-m002"
                },
                {
                  "id": "SYNTHETIC-K01-r002",
                  "kind": "historical",
                  "begin_after": "SYNTHETIC-K01-m001",
                  "end_before": "$trial_end"
                }
              ]
            },
            {
              "id": "SYNTHETIC-K01-v002",
              "message": "SYNTHETIC-K01-m002",
              "change": "change",
              "status": "active",
              "value": "zekru-4",
              "sources": [
                {
                  "message": "SYNTHETIC-K01-m002",
                  "authority": "workshop coordinator",
                  "value": "zekru-4"
                }
              ],
              "time": {
                "begin": null,
                "end": null
              },
              "applicability": "Velrin bench, drawer code, workshop",
              "requirements": [
                {
                  "id": "SYNTHETIC-K01-r003",
                  "kind": "current",
                  "begin_after": "SYNTHETIC-K01-m002",
                  "end_before": "SYNTHETIC-K01-m003"
                },
                {
                  "id": "SYNTHETIC-K01-r004",
                  "kind": "historical",
                  "begin_after": "SYNTHETIC-K01-m002",
                  "end_before": "$trial_end"
                }
              ]
            },
            {
              "id": "SYNTHETIC-K01-v003",
              "message": "SYNTHETIC-K01-m003",
              "change": "change",
              "status": "active",
              "value": "nalvi-7",
              "sources": [
                {
                  "message": "SYNTHETIC-K01-m003",
                  "authority": "workshop coordinator",
                  "value": "nalvi-7"
                }
              ],
              "time": {
                "begin": null,
                "end": null
              },
              "applicability": "Velrin bench, drawer code, workshop",
              "requirements": [
                {
                  "id": "SYNTHETIC-K01-r005",
                  "kind": "current",
                  "begin_after": "SYNTHETIC-K01-m003",
                  "end_before": "SYNTHETIC-K01-m004"
                },
                {
                  "id": "SYNTHETIC-K01-r006",
                  "kind": "historical",
                  "begin_after": "SYNTHETIC-K01-m003",
                  "end_before": "$trial_end"
                }
              ]
            },
            {
              "id": "SYNTHETIC-K01-v004",
              "message": "SYNTHETIC-K01-m004",
              "change": "change",
              "status": "active",
              "value": "tovri-8",
              "sources": [
                {
                  "message": "SYNTHETIC-K01-m004",
                  "authority": "workshop coordinator",
                  "value": "tovri-8"
                }
              ],
              "time": {
                "begin": null,
                "end": null
              },
              "applicability": "Velrin bench, drawer code, workshop",
              "requirements": [
                {
                  "id": "SYNTHETIC-K01-r007",
                  "kind": "current",
                  "begin_after": "SYNTHETIC-K01-m004",
                  "end_before": "$trial_end"
                },
                {
                  "id": "SYNTHETIC-K01-r008",
                  "kind": "historical",
                  "begin_after": "SYNTHETIC-K01-m004",
                  "end_before": "$trial_end"
                }
              ]
            }
          ]
        }
      ],
      "recoveries": [],
      "predictions": [
        {
          "arm": "A",
          "failing": null,
          "reason": "The complete conversation supplies the declared evidence; this fixture predicts no execution outcome."
        },
        {
          "arm": "B",
          "failing": null,
          "reason": "The question omits the fictional values; guessing success has not been measured."
        },
        {
          "arm": "C",
          "failing": null,
          "reason": "Isolated statements may omit order or scope; the selected statement policy is unspecified."
        },
        {
          "arm": "D",
          "failing": null,
          "reason": "An exact passage can supply some evidence; passage selection and execution are unspecified."
        },
        {
          "arm": "E",
          "failing": null,
          "reason": "This condition has no specified behavior in the brief."
        },
        {
          "arm": "F",
          "failing": null,
          "reason": "This condition has no specified behavior in the brief."
        }
      ]
    },
    {
      "id": "SYNTHETIC-K02",
      "family": "F2",
      "coverage_tags": {
        "chain_depth": 2,
        "distance": 3,
        "entity_similarity": "distinct",
        "ambiguity_status": "expired",
        "provenance_need": "none",
        "context_pressure": "within",
        "verbatim_possible": true,
        "subcases": [
          "retraction"
        ]
      },
      "conversation": [
        {
          "id": "SYNTHETIC-K02-m001",
          "text": "[SYNTHETIC-K02-m001] The Meruv studio delivery phrase is peska-6.",
          "recap": false
        },
        {